{"$id":"https://vivekn4.github.io/doomscroll-guard/rules/schema.json","$schema":"https://json-schema.org/draft/2020-12/schema","description":"Versioned detection bundle shared by the Android and iOS apps. Validated by tools/validate_rules.py before release.","properties":{"android":{"properties":{"engine":{"properties":{"debounce_ms":{"maximum":5000,"minimum":100,"type":"integer"},"event_types":{"items":{"type":"string"},"minItems":1,"type":"array"},"notification_timeout_ms":{"maximum":1000,"minimum":0,"type":"integer"}},"required":["debounce_ms","notification_timeout_ms","event_types"],"type":"object"},"targets":{"items":{"properties":{"id":{"pattern":"^[a-z0-9_]+$","type":"string"},"intervention":{"enum":["back","home","overlay"]},"label":{"minLength":1,"type":"string"},"notes":{"type":"string"},"packages":{"items":{"pattern":"^[a-z][a-z0-9_]*(\\.[a-z0-9_]+)+$","type":"string"},"minItems":1,"type":"array"},"requires_layout_corroboration":{"type":"boolean"},"text_markers":{"items":{"minLength":1,"type":"string"},"type":"array"},"view_ids":{"items":{"pattern":"^[a-z][a-z0-9_]*$","type":"string"},"type":"array"},"whole_app_block":{"type":"boolean"}},"required":["id","label","packages","intervention"],"type":"object"},"minItems":1,"type":"array"}},"required":["engine","targets"],"type":"object"},"bundle_version":{"description":"Semver. Bump minor when rules change, major when schema changes.","pattern":"^(0|[1-9]\\d*)\\.(0|[1-9]\\d*)\\.(0|[1-9]\\d*)$","type":"string"},"generated":{"pattern":"^\\d{4}-\\d{2}-\\d{2}$","type":"string"},"ios":{"properties":{"safari_content_blocker":{"items":{"properties":{"action":{"properties":{"selector":{"type":"string"},"type":{"enum":["css-display-none","block","block-cookies"]}},"required":["type"],"type":"object"},"trigger":{"properties":{"if-domain":{"items":{"type":"string"},"type":"array"},"resource-type":{"items":{"type":"string"},"type":"array"},"unless-domain":{"items":{"type":"string"},"type":"array"},"url-filter":{"minLength":1,"type":"string"}},"required":["url-filter"],"type":"object"}},"required":["trigger","action"],"type":"object"},"type":"array"},"shields":{"properties":{"apps":{"items":{"type":"string"},"type":"array"},"note":{"type":"string"}},"required":["note","apps"],"type":"object"},"wrapper":{"properties":{"js_rules":{"items":{"properties":{"action":{"enum":["route-rewrite","route-block","dom-remove"]},"css_selectors":{"items":{"minLength":1,"type":"string"},"type":"array"},"hosts":{"items":{"type":"string"},"minItems":1,"type":"array"},"id":{"pattern":"^[a-z0-9_\\-]+$","type":"string"},"match_url_pattern":{"type":"string"},"note":{"type":"string"},"rewrite_to":{"type":"string"}},"required":["id","hosts","action"],"type":"object"},"type":"array"},"tabs":{"items":{"properties":{"allowed_hosts":{"items":{"type":"string"},"type":"array"},"id":{"pattern":"^[a-z0-9_]+$","type":"string"},"label":{"type":"string"},"start_url":{"pattern":"^https://","type":"string"}},"required":["id","label","start_url","allowed_hosts"],"type":"object"},"type":"array"}},"required":["tabs","js_rules"],"type":"object"}},"required":["wrapper","shields","safari_content_blocker"],"type":"object"},"signature":{"properties":{"algorithm":{"const":"ed25519"},"key_id":{"minLength":1,"type":"string"},"note":{"type":"string"},"value":{"description":"Base64 signature over the canonical JSON. Null until release signing is wired.","type":["string","null"]}},"required":["algorithm","key_id","value","note"],"type":"object"}},"required":["bundle_version","generated","signature","android","ios"],"title":"Doomscroll Guard rule bundle","type":"object"}