{"android":{"engine":{"debounce_ms":600,"event_types":["TYPE_WINDOW_STATE_CHANGED","TYPE_WINDOW_CONTENT_CHANGED","TYPE_VIEW_SCROLLED"],"notification_timeout_ms":100},"targets":[{"id":"youtube_shorts","intervention":"back","label":"YouTube Shorts","notes":"IDs are undocumented YouTube internals and rot between app updates. Re-verify with 'adb shell uiautomator dump' when detection degrades. Text-marker fallback requires fullscreen-vertical-video layout corroboration.","packages":["com.google.android.youtube","app.revanced.android.youtube","com.vanced.android.youtube"],"requires_layout_corroboration":true,"text_markers":["Shorts"],"view_ids":["shorts_container","reel_player_page","reel_player_page_container","reel_recycler_view","shorts_control_panel","shorts_video_player"],"whole_app_block":false},{"id":"instagram_reels","intervention":"back","label":"Instagram Reels","notes":"Same ID-rot caveat as YouTube. The Reels tab itself is a surface; the player page is the primary intercept point.","packages":["com.instagram.android"],"requires_layout_corroboration":true,"text_markers":["Reels"],"view_ids":["clips_viewer_container","reel_viewer_fragment","clips_recycler_view","clips_viewer_pager"],"whole_app_block":false},{"id":"tiktok","intervention":"home","label":"TikTok (whole app)","notes":"TikTok is all short-form video — there is no meaningful 'TikTok without short videos'. Enabling this switch blocks the app itself. Regional package variants (e.g. com.ss.android.ugc.trill) are NOT yet confirmed; add after verification.","packages":["com.zhiliaoapp.musically"],"requires_layout_corroboration":false,"text_markers":[],"view_ids":[],"whole_app_block":true},{"id":"snapchat_spotlight","intervention":"back","label":"Snapchat Spotlight","notes":"stories_feed_recycler_view can also match the friends' Stories feed — layout corroboration (fullscreen vertical video) is required before intervening.","packages":["com.snapchat.android"],"requires_layout_corroboration":true,"text_markers":["Spotlight"],"view_ids":["spotlight_container","stories_feed_recycler_view","snap_view"],"whole_app_block":false},{"id":"facebook_reels","intervention":"back","label":"Facebook Reels","notes":"No stable view IDs documented for FB Reels; text-marker + layout corroboration only. Lower confidence — prefer overlay (friction) over back-action here.","packages":["com.facebook.katana"],"requires_layout_corroboration":true,"text_markers":["Reels"],"view_ids":[],"whole_app_block":false}]},"bundle_version":"1.0.0","generated":"2026-10-12","ios":{"safari_content_blocker":[{"action":{"selector":"ytm-reel-shelf-renderer, ytm-pivot-bar-item-renderer:has(.pivot-shorts), a[href^=\"/shorts\"]","type":"css-display-none"},"trigger":{"if-domain":["m.youtube.com","www.youtube.com"],"url-filter":".*"}},{"action":{"selector":"a[href^=\"/reels\"], svg[aria-label=\"Reels\"]","type":"css-display-none"},"trigger":{"if-domain":["www.instagram.com"],"url-filter":".*"}}],"shields":{"apps":["youtube","instagram","tiktok"],"note":"Whole-app shields via FamilyControls ManagedSettingsStore. Requires the com.apple.developer.family-controls entitlement (gated, per bundle ID). The user picks the actual apps in the system FamilyActivityPicker — tokens are opaque, so these labels are UI hints only, never identifiers."},"wrapper":{"js_rules":[{"action":"route-rewrite","hosts":["m.youtube.com","www.youtube.com"],"id":"yt-shorts-route","match_url_pattern":"^https://(m|www)\\.youtube\\.com/shorts/([A-Za-z0-9_-]{6,})","note":"Deep-links and in-page taps to /shorts/<id> become regular watch pages.","rewrite_to":"https://www.youtube.com/watch?v=$2"},{"action":"dom-remove","css_selectors":["ytm-reel-shelf-renderer","ytm-pivot-bar-item-renderer:has(.pivot-shorts)","a[href^=\"/shorts\"]","[aria-label=\"Shorts\"]","ytd-reel-shelf-renderer","ytd-rich-shelf-renderer[is-shorts]"],"hosts":["m.youtube.com","www.youtube.com"],"id":"yt-shorts-dom","note":"Selectors rot with YouTube web updates; MutationObserver re-cleans. Desktop selectors included for www fallback."},{"action":"route-block","hosts":["www.instagram.com"],"id":"ig-reels-route","match_url_pattern":"^https://www\\.instagram\\.com/(reels?|reel)/","note":"Navigations into /reels/ or /reel/ are stopped and bounced to the feed."},{"action":"dom-remove","css_selectors":["a[href=\"/reels/\"]","a[href^=\"/reels\"]","svg[aria-label=\"Reels\"]","[aria-label=\"Reels\"]"],"hosts":["www.instagram.com"],"id":"ig-reels-dom","note":"Instagram's web app is a JS-heavy SPA; selectors need periodic maintenance."}],"tabs":[{"allowed_hosts":["m.youtube.com","www.youtube.com","youtube.com","youtu.be","googlevideo.com","ytimg.com"],"id":"youtube","label":"YouTube","start_url":"https://m.youtube.com/"},{"allowed_hosts":["www.instagram.com","instagram.com","cdninstagram.com","fbcdn.net"],"id":"instagram","label":"Instagram","start_url":"https://www.instagram.com/"}]}},"signature":{"algorithm":"ed25519","key_id":"doomscroll-guard-release-1","note":"Signed at release time. Bundles ship unsigned only in dev builds; the apps must refuse unsigned bundles in release builds. See docs/play-policy.md.","value":null}}